{
  "schemaVersion": 1,
  "id": "peregrine-trainer",
  "name": "Peregrine experimental trainer (original placeholder)",
  "massKg": 9000,
  "wingAreaM2": 32,
  "gearHeightM": 2.2,
  "stallAlphaRad": 0.28,
  "aero": {
    "alphaRad": [
      -3.141592653589793, -1.57, -0.6, -0.4, -0.28, -0.18, 0, 0.08, 0.18, 0.28, 0.4, 0.6, 1.57,
      3.141592653589793
    ],
    "mach": [0, 0.6, 0.9, 1.2, 2.0],
    "lift": [
      [0, 0, 0.0, 0.0, 0.0],
      [0, 0, 0.0, 0.0, 0.0],
      [-0.45, -0.45, -0.405, -0.36000000000000004, -0.29250000000000004],
      [-0.85, -0.85, -0.765, -0.68, -0.5525],
      [-1.4, -1.4, -1.26, -1.1199999999999999, -0.9099999999999999],
      [-0.94, -0.94, -0.846, -0.752, -0.611],
      [0, 0, 0.0, 0.0, 0.0],
      [0.42, 0.42, 0.378, 0.336, 0.273],
      [0.94, 0.94, 0.846, 0.752, 0.611],
      [1.4, 1.4, 1.26, 1.1199999999999999, 0.9099999999999999],
      [0.85, 0.85, 0.765, 0.68, 0.5525],
      [0.45, 0.45, 0.405, 0.36000000000000004, 0.29250000000000004],
      [0, 0, 0.0, 0.0, 0.0],
      [0, 0, 0.0, 0.0, 0.0]
    ],
    "drag": [
      [0.1, 0.1, 0.14, 0.18, 0.15000000000000002],
      [1.8, 1.8, 1.84, 1.8800000000000001, 1.85],
      [0.7, 0.7, 0.74, 0.7799999999999999, 0.75],
      [0.3, 0.3, 0.33999999999999997, 0.38, 0.35],
      [0.16, 0.16, 0.2, 0.24, 0.21000000000000002],
      [0.072, 0.072, 0.11199999999999999, 0.152, 0.122],
      [0.023, 0.023, 0.063, 0.10300000000000001, 0.07300000000000001],
      [0.033, 0.033, 0.07300000000000001, 0.113, 0.083],
      [0.072, 0.072, 0.11199999999999999, 0.152, 0.122],
      [0.16, 0.16, 0.2, 0.24, 0.21000000000000002],
      [0.3, 0.3, 0.33999999999999997, 0.38, 0.35],
      [0.7, 0.7, 0.74, 0.7799999999999999, 0.75],
      [1.8, 1.8, 1.84, 1.8800000000000001, 1.85],
      [0.1, 0.1, 0.14, 0.18, 0.15000000000000002]
    ]
  },
  "engine": {
    "altitudeM": [0, 5000, 10000, 20000, 30000],
    "mach": [0, 0.6, 1.2, 2],
    "thrustN": [
      [70000, 67200.0, 58100.0, 45500.0],
      [49000.0, 47040.0, 40670.0, 31850.0],
      [30100.0, 28896.0, 24983.0, 19565.0],
      [8400.0, 8064.0, 6972.0, 5460.0],
      [0, 0.0, 0.0, 0.0]
    ]
  },
  "controls": {
    "pitchRateRadS": 0.85,
    "rollRateRadS": 1.7,
    "yawRateRadS": 0.35,
    "responseSeconds": 0.18
  },
  "landing": {
    "maxSinkMps": 5,
    "maxBankRad": 0.22,
    "maxSlopeRad": 0.12,
    "rollingFriction": 0.025,
    "brakeDecelerationMps2": 4.5
  }
}
